{
  "schema_version": "openguard.notice-license-facts/3",
  "package_status": "draft_facts_only",
  "generated_at": "2026-10-11T11:26:46Z",
  "producer": {
    "name": "openguard-b03-b04-inventory-generator",
    "version": "3.0.1"
  },
  "source_inputs": [
    {
      "path": "LICENSE",
      "source_file_sha256": "c71d239df91726fc519c6eb72d318ec65820627232b2f796219e87dcf35d0ab4",
      "source_revision": "9d67b88f39fa4aaa8ab24048aea224204eabd490"
    },
    {
      "path": "backend/pyproject.toml",
      "source_file_sha256": "941e9f9135d63c940fd13595ec1f978fbbe9d5ba6e70595f514ce925fcba7aa3",
      "source_revision": "9d67b88f39fa4aaa8ab24048aea224204eabd490"
    },
    {
      "path": "backend/java/pom.xml",
      "source_file_sha256": "b84aa40bdeaa80a847a104a4a1501d153d51979c461fc3a10312de4445379077",
      "source_revision": "9d67b88f39fa4aaa8ab24048aea224204eabd490"
    },
    {
      "path": "frontend/package.json",
      "source_file_sha256": "a8e9bab912ffc5ef1afc2da36db5b0de932ce872e235e02b55dce9ceca65f09a",
      "source_revision": "9d67b88f39fa4aaa8ab24048aea224204eabd490"
    },
    {
      "path": "tests/fixtures/huggingface/resource-profile-v1/manifest.json",
      "source_file_sha256": "2474035e7182f8140fbe4e71dad1b9035aa598873aa483dab010a7c17dde28b6",
      "source_revision": "9d67b88f39fa4aaa8ab24048aea224204eabd490"
    }
  ],
  "evidence": [
    {
      "evidence_id": "evidence.root.license",
      "kind": "repository_file",
      "locator": "LICENSE",
      "source_path": "LICENSE",
      "source_url": null,
      "source_revision": "9d67b88f39fa4aaa8ab24048aea224204eabd490",
      "content_scope": "whole_file",
      "source_file_sha256": "c71d239df91726fc519c6eb72d318ec65820627232b2f796219e87dcf35d0ab4",
      "selected_content_sha256": "c71d239df91726fc519c6eb72d318ec65820627232b2f796219e87dcf35d0ab4",
      "selected_json_pointer": null,
      "captured_at": "2026-09-22T09:30:00Z",
      "producer": {
        "name": "openguard-b03-b04-inventory-generator",
        "version": "3.0.1"
      }
    },
    {
      "evidence_id": "evidence.dependency.python.fastapi",
      "kind": "repository_file",
      "locator": "backend/pyproject.toml#project.dependencies[fastapi]",
      "source_path": "backend/pyproject.toml",
      "source_url": null,
      "source_revision": "9d67b88f39fa4aaa8ab24048aea224204eabd490",
      "content_scope": "toml_declaration",
      "source_file_sha256": "941e9f9135d63c940fd13595ec1f978fbbe9d5ba6e70595f514ce925fcba7aa3",
      "selected_content_sha256": "8d4541f2b94805fd330493f77ec273a03deb89a623d6408b919bcb2e07af9d72",
      "selected_json_pointer": null,
      "captured_at": "2026-09-22T09:30:00Z",
      "producer": {
        "name": "openguard-b03-b04-inventory-generator",
        "version": "3.0.1"
      }
    },
    {
      "evidence_id": "evidence.dependency.python.packaging",
      "kind": "repository_file",
      "locator": "backend/pyproject.toml#project.dependencies[packaging]",
      "source_path": "backend/pyproject.toml",
      "source_url": null,
      "source_revision": "9d67b88f39fa4aaa8ab24048aea224204eabd490",
      "content_scope": "toml_declaration",
      "source_file_sha256": "941e9f9135d63c940fd13595ec1f978fbbe9d5ba6e70595f514ce925fcba7aa3",
      "selected_content_sha256": "b0ed3d65d95fc15ccc8dc5e02e997f2de85358cdcd15c0fdb1c0a4de13a25f97",
      "selected_json_pointer": null,
      "captured_at": "2026-09-22T09:30:00Z",
      "producer": {
        "name": "openguard-b03-b04-inventory-generator",
        "version": "3.0.1"
      }
    },
    {
      "evidence_id": "evidence.dependency.python.pydantic",
      "kind": "repository_file",
      "locator": "backend/pyproject.toml#project.dependencies[pydantic]",
      "source_path": "backend/pyproject.toml",
      "source_url": null,
      "source_revision": "9d67b88f39fa4aaa8ab24048aea224204eabd490",
      "content_scope": "toml_declaration",
      "source_file_sha256": "941e9f9135d63c940fd13595ec1f978fbbe9d5ba6e70595f514ce925fcba7aa3",
      "selected_content_sha256": "f7357a287249977e5e98778e77cb343901a033ba817758e4a7c64f2837df096b",
      "selected_json_pointer": null,
      "captured_at": "2026-09-22T09:30:00Z",
      "producer": {
        "name": "openguard-b03-b04-inventory-generator",
        "version": "3.0.1"
      }
    },
    {
      "evidence_id": "evidence.dependency.python.python-multipart",
      "kind": "repository_file",
      "locator": "backend/pyproject.toml#project.dependencies[python-multipart]",
      "source_path": "backend/pyproject.toml",
      "source_url": null,
      "source_revision": "9d67b88f39fa4aaa8ab24048aea224204eabd490",
      "content_scope": "toml_declaration",
      "source_file_sha256": "941e9f9135d63c940fd13595ec1f978fbbe9d5ba6e70595f514ce925fcba7aa3",
      "selected_content_sha256": "994d37da08546ddcd189ee201f24b7cce420186a8d7cdb6a61be43e3ffccb04f",
      "selected_json_pointer": null,
      "captured_at": "2026-09-22T09:30:00Z",
      "producer": {
        "name": "openguard-b03-b04-inventory-generator",
        "version": "3.0.1"
      }
    },
    {
      "evidence_id": "evidence.dependency.python.uvicorn",
      "kind": "repository_file",
      "locator": "backend/pyproject.toml#project.dependencies[uvicorn]",
      "source_path": "backend/pyproject.toml",
      "source_url": null,
      "source_revision": "9d67b88f39fa4aaa8ab24048aea224204eabd490",
      "content_scope": "toml_declaration",
      "source_file_sha256": "941e9f9135d63c940fd13595ec1f978fbbe9d5ba6e70595f514ce925fcba7aa3",
      "selected_content_sha256": "8b180c7986941523ee77737c2dcc4f2a568f1351f41fb4a85711104ca7b56a7b",
      "selected_json_pointer": null,
      "captured_at": "2026-09-22T09:30:00Z",
      "producer": {
        "name": "openguard-b03-b04-inventory-generator",
        "version": "3.0.1"
      }
    },
    {
      "evidence_id": "evidence.dependency.python.httpx2",
      "kind": "repository_file",
      "locator": "backend/pyproject.toml#project.optional-dependencies.dev[httpx2]",
      "source_path": "backend/pyproject.toml",
      "source_url": null,
      "source_revision": "9d67b88f39fa4aaa8ab24048aea224204eabd490",
      "content_scope": "toml_declaration",
      "source_file_sha256": "941e9f9135d63c940fd13595ec1f978fbbe9d5ba6e70595f514ce925fcba7aa3",
      "selected_content_sha256": "1900e0a7a5a3fa89b64470f7cf07b465372233cf45c24e4c72155cfa4cac1c98",
      "selected_json_pointer": null,
      "captured_at": "2026-09-22T09:30:00Z",
      "producer": {
        "name": "openguard-b03-b04-inventory-generator",
        "version": "3.0.1"
      }
    },
    {
      "evidence_id": "evidence.dependency.python.jsonschema",
      "kind": "repository_file",
      "locator": "backend/pyproject.toml#project.optional-dependencies.dev[jsonschema]",
      "source_path": "backend/pyproject.toml",
      "source_url": null,
      "source_revision": "9d67b88f39fa4aaa8ab24048aea224204eabd490",
      "content_scope": "toml_declaration",
      "source_file_sha256": "941e9f9135d63c940fd13595ec1f978fbbe9d5ba6e70595f514ce925fcba7aa3",
      "selected_content_sha256": "26c5a68f7225b548eda60ab6442a39deb2a532775129951916c67cf84d01be7b",
      "selected_json_pointer": null,
      "captured_at": "2026-09-22T09:30:00Z",
      "producer": {
        "name": "openguard-b03-b04-inventory-generator",
        "version": "3.0.1"
      }
    },
    {
      "evidence_id": "evidence.dependency.python.pytest",
      "kind": "repository_file",
      "locator": "backend/pyproject.toml#project.optional-dependencies.dev[pytest]",
      "source_path": "backend/pyproject.toml",
      "source_url": null,
      "source_revision": "9d67b88f39fa4aaa8ab24048aea224204eabd490",
      "content_scope": "toml_declaration",
      "source_file_sha256": "941e9f9135d63c940fd13595ec1f978fbbe9d5ba6e70595f514ce925fcba7aa3",
      "selected_content_sha256": "59c2cfda3ce5d2e0c764f970febd72f2e945d11be273986db54e59f6f3fb547f",
      "selected_json_pointer": null,
      "captured_at": "2026-09-22T09:30:00Z",
      "producer": {
        "name": "openguard-b03-b04-inventory-generator",
        "version": "3.0.1"
      }
    },
    {
      "evidence_id": "evidence.dependency.java.spring-boot-starter-web",
      "kind": "repository_file",
      "locator": "backend/java/pom.xml#dependency[groupId=org.springframework.boot;artifactId=spring-boot-starter-web]",
      "source_path": "backend/java/pom.xml",
      "source_url": null,
      "source_revision": "9d67b88f39fa4aaa8ab24048aea224204eabd490",
      "content_scope": "xml_dependency",
      "source_file_sha256": "b84aa40bdeaa80a847a104a4a1501d153d51979c461fc3a10312de4445379077",
      "selected_content_sha256": "666701249b83228c54bb2e024ea094014deef39fcbaf087138bf939eaa282eb2",
      "selected_json_pointer": null,
      "captured_at": "2026-09-22T09:30:00Z",
      "producer": {
        "name": "openguard-b03-b04-inventory-generator",
        "version": "3.0.1"
      }
    },
    {
      "evidence_id": "evidence.dependency.java.jackson-databind",
      "kind": "repository_file",
      "locator": "backend/java/pom.xml#dependency[groupId=com.fasterxml.jackson.core;artifactId=jackson-databind]",
      "source_path": "backend/java/pom.xml",
      "source_url": null,
      "source_revision": "9d67b88f39fa4aaa8ab24048aea224204eabd490",
      "content_scope": "xml_dependency",
      "source_file_sha256": "b84aa40bdeaa80a847a104a4a1501d153d51979c461fc3a10312de4445379077",
      "selected_content_sha256": "7edc56060e48d63e66b499ef0ab124edca32475dc15611cae19f7db21e7b6365",
      "selected_json_pointer": null,
      "captured_at": "2026-09-22T09:30:00Z",
      "producer": {
        "name": "openguard-b03-b04-inventory-generator",
        "version": "3.0.1"
      }
    },
    {
      "evidence_id": "evidence.dependency.java.json-schema-validator",
      "kind": "repository_file",
      "locator": "backend/java/pom.xml#dependency[groupId=com.networknt;artifactId=json-schema-validator]",